{"kind":"library","playlists":[{"name":"Adaptive Set","play_orders":[{"entries":[{"position":0,"target_tempo":118,"track_id":"1f339d22595b5432c8736d40002a99db59f2c2ed"},{"position":1,"target_tempo":120,"track_id":"5544528fd4850f12906bd442966bc6a8fe83473e"}],"name":"warm-up"},{"entries":[{"key_sync":true,"position":0,"target_tempo":128,"track_id":"5544528fd4850f12906bd442966bc6a8fe83473e"},{"key_sync":true,"position":1,"target_tempo":130,"track_id":"1f339d22595b5432c8736d40002a99db59f2c2ed"}],"name":"peak-time"}],"playlist_id":"pl_mixed","tracks_ordered":["1f339d22595b5432c8736d40002a99db59f2c2ed","5544528fd4850f12906bd442966bc6a8fe83473e"]}],"schema_version":"0.2","tracks":[{"artists":["X"],"content_hash":"sha256:06d45d558545d088cf082a26c7a532af9d2f472fcb18fdc75a9169b9504394b3","duration_ms":200000,"file_path":"/music/a.mp3","isrc":"USPLA0000001","title":"Track A","track_id":"1f339d22595b5432c8736d40002a99db59f2c2ed"},{"artists":["Y"],"content_hash":"sha256:a3cc7d74511fddf74c4e0e2dec2337c969eea95c865823300ad62abcc45c3174","duration_ms":210000,"file_path":"/music/b.mp3","isrc":"USPLA0000002","title":"Track B","track_id":"5544528fd4850f12906bd442966bc6a8fe83473e"}]}